{
  "$schema": "http://json-schema.org/draft-07/schema#",
  "title": "Article Schema",
  "description": "Schema for article data extraction",
  "type": "object",
  "required": ["title", "content"],
  "properties": {
    "title": {
      "type": "string",
      "description": "The article title or headline",
      "minLength": 3
    },
    "author": {
      "type": "object",
      "description": "Information about the article author",
      "properties": {
        "name": {
          "type": "string"
        },
        "url": {
          "type": "string",
          "format": "uri"
        },
        "bio": {
          "type": "string"
        },
        "image": {
          "type": "string",
          "format": "uri"
        }
      },
      "required": ["name"]
    },
    "date_published": {
      "type": "string",
      "description": "The date the article was published",
      "format": "date-time"
    },
    "date_modified": {
      "type": "string",
      "description": "The date the article was last modified",
      "format": "date-time"
    },
    "content": {
      "type": "string",
      "description": "The main article content"
    },
    "description": {
      "type": "string",
      "description": "A short description or summary of the article"
    },
    "featured_image": {
      "type": "object",
      "description": "The main image associated with the article",
      "properties": {
        "url": {
          "type": "string",
          "format": "uri"
        },
        "alt": {
          "type": "string"
        },
        "caption": {
          "type": "string"
        }
      },
      "required": ["url"]
    },
    "images": {
      "type": "array",
      "description": "All images within the article",
      "items": {
        "type": "object",
        "properties": {
          "url": {
            "type": "string",
            "format": "uri"
          },
          "alt": {
            "type": "string"
          },
          "caption": {
            "type": "string"
          }
        },
        "required": ["url"]
      }
    },
    "tags": {
      "type": "array",
      "description": "Tags or keywords associated with the article",
      "items": {
        "type": "string"
      }
    },
    "category": {
      "type": "array",
      "description": "Categories the article belongs to",
      "items": {
        "type": "string"
      }
    },
    "url": {
      "type": "string",
      "description": "URL of the article",
      "format": "uri"
    },
    "section_headings": {
      "type": "array",
      "description": "Headings/sections within the article",
      "items": {
        "type": "object",
        "properties": {
          "level": {
            "type": "integer",
            "minimum": 1,
            "maximum": 6
          },
          "text": {
            "type": "string"
          }
        },
        "required": ["text"]
      }
    },
    "comments_count": {
      "type": "integer",
      "description": "Number of comments on the article",
      "minimum": 0
    },
    "publisher": {
      "type": "object",
      "description": "Information about the publisher",
      "properties": {
        "name": {
          "type": "string"
        },
        "url": {
          "type": "string",
          "format": "uri"
        },
        "logo": {
          "type": "string",
          "format": "uri"
        }
      },
      "required": ["name"]
    },
    "reading_time": {
      "type": "integer",
      "description": "Estimated reading time in minutes",
      "minimum": 1
    },
    "_metadata": {
      "type": "object",
      "description": "Metadata about the extraction",
      "properties": {
        "extractor": {
          "type": "string"
        },
        "confidence": {
          "type": "number",
          "minimum": 0,
          "maximum": 1
        },
        "extraction_time": {
          "type": "string",
          "format": "date-time"
        }
      }
    }
  }
}
