{
  "title": "The Future of Artificial Intelligence in Healthcare",
  "author": {
    "name": "Dr. Emily Chen",
    "url": "https://example.com/authors/emily-chen",
    "bio": "Dr. Emily Chen is a healthcare technology researcher and practicing physician specializing in the ethical implementation of AI in clinical settings. She holds a Ph.D. in Medical Informatics from Stanford University and currently serves as the Director of Medical AI Research at TechInsight Institute.",
    "image": "/images/authors/emily-chen.jpg"
  },
  "date_published": "2023-10-15T08:00:00+00:00",
  "content": "Artificial Intelligence (AI) is rapidly transforming the healthcare industry, promising to revolutionize everything from disease diagnosis to patient care and administrative processes. This technological evolution offers unprecedented opportunities to improve healthcare outcomes while potentially reducing costs and increasing accessibility.\n\nThe integration of AI in healthcare is already underway, with numerous applications showing promising results in clinical settings. Machine learning algorithms are being used to analyze medical images with accuracy that rivals or even exceeds that of human specialists in certain scenarios.",
  "description": "Explore how AI technologies are transforming healthcare with improved diagnostics, personalized treatment plans, and streamlined administrative processes.",
  "featured_image": {
    "url": "/images/ai-healthcare-header.jpg",
    "alt": "AI in Healthcare illustration showing a doctor with holographic medical interfaces",
    "caption": "AI technologies are revolutionizing how healthcare providers diagnose and treat patients."
  },
  "images": [
    {
      "url": "/images/ai-healthcare-header.jpg",
      "alt": "AI in Healthcare illustration showing a doctor with holographic medical interfaces",
      "caption": "AI technologies are revolutionizing how healthcare providers diagnose and treat patients."
    },
    {
      "url": "/images/ai-diagnostics.jpg",
      "alt": "Medical professional reviewing AI diagnostic results",
      "caption": "AI-assisted diagnostics can help identify patterns that might be missed by human observation alone."
    },
    {
      "url": "/images/ai-future-healthcare.jpg",
      "alt": "Futuristic healthcare environment with AI integration",
      "caption": "The healthcare facilities of the future will likely feature seamless integration of AI technologies throughout the patient journey."
    }
  ],
  "tags": [
    "Artificial Intelligence",
    "Healthcare",
    "Medical Technology",
    "Diagnostics",
    "Future Tech"
  ],
  "category": [
    "Technology",
    "Healthcare"
  ],
  "url": "https://example.com/blog/ai-in-healthcare",
  "section_headings": [
    {
      "level": 2,
      "text": "The Current State of AI in Healthcare"
    },
    {
      "level": 2,
      "text": "Transforming Diagnostics and Treatment"
    },
    {
      "level": 3,
      "text": "Key AI Technologies in Healthcare"
    },
    {
      "level": 2,
      "text": "Challenges and Ethical Considerations"
    },
    {
      "level": 2,
      "text": "The Future Outlook"
    },
    {
      "level": 2,
      "text": "Conclusion"
    }
  ],
  "comments_count": 12,
  "publisher": {
    "name": "TechInsight",
    "url": "https://example.com",
    "logo": "https://example.com/images/logo.png"
  },
  "reading_time": 8
}
